{"$schema":"https://json-schema.org/draft/2020-12/schema","type":"object","required":["schema_version","slug","definition_version","executable","adapter_id","interaction_modes","model_requirement","credential_bindings","config_documents","image"],"properties":{"schema_version":{"type":"integer","const":1},"slug":{"type":"string"},"definition_version":{"type":"string"},"internal":{"type":"boolean"},"executable":{"type":"string"},"adapter_id":{"type":"string"},"interaction_modes":{"type":"array","items":{"enum":["pty","acp"]},"minItems":1},"model_requirement":{"type":"object","additionalProperties":false,"required":["required","protocol_adapters"],"properties":{"required":{"type":"boolean"},"protocol_adapters":{"type":"array","items":{"type":"string"}}},"allOf":[{"if":{"properties":{"required":{"const":true}}},"then":{"properties":{"protocol_adapters":{"minItems":1}}},"else":{"properties":{"protocol_adapters":{"maxItems":0}}}}]},"tool_model_requirements":{"type":"array","items":{"type":"object","additionalProperties":false,"required":["id","provider_keys","protocol_adapters","modality","capability","environment"],"properties":{"id":{"type":"string"},"provider_keys":{"type":"array","minItems":1,"items":{"type":"string"}},"protocol_adapters":{"type":"array","minItems":1,"items":{"type":"string"}},"modality":{"type":"string"},"capability":{"type":"string"},"environment":{"type":"object","additionalProperties":false,"required":["api_key","base_url","model_id"],"properties":{"api_key":{"type":"string"},"base_url":{"type":"string"},"model_id":{"type":"string"}}}}}},"credential_bindings":{"type":"array","items":{"type":"object","additionalProperties":false,"required":["id","source","target"],"properties":{"id":{"type":"string"},"source":{"type":"object","additionalProperties":false,"required":["kind","ref"],"properties":{"kind":{"enum":["model_resource","credential_bundle"]},"ref":{"type":"string"}}},"target":{"type":"object","additionalProperties":false,"required":["kind","name"],"properties":{"kind":{"const":"env"},"name":{"type":"string"}}}}}},"credential_requirement_groups":{"type":"array","items":{"type":"object","additionalProperties":false,"required":["id","any_of"],"properties":{"id":{"type":"string"},"any_of":{"type":"array","minItems":2,"items":{"type":"string"}}}}},"config_documents":{"type":"array","items":{"type":"object","additionalProperties":false,"required":["id","format","target_path","required"],"properties":{"id":{"type":"string"},"format":{"const":"json"},"target_path":{"type":"string"},"required":{"type":"boolean"}}}},"image":{"type":"object"}}}
