{"schema_version":1,"slug":"aider","definition_version":"2","executable":"aider","adapter_id":"aider-pty","interaction_modes":["pty"],"model_requirement":{"required":false,"protocol_adapters":[]},"credential_bindings":[{"id":"openai","source":{"kind":"credential_bundle","ref":"aider"},"target":{"kind":"env","name":"OPENAI_API_KEY"}},{"id":"anthropic","source":{"kind":"credential_bundle","ref":"aider"},"target":{"kind":"env","name":"ANTHROPIC_API_KEY"}}],"credential_requirement_groups":[{"id":"provider-api-key","any_of":["OPENAI_API_KEY","ANTHROPIC_API_KEY"]}],"config_documents":[],"image":{"runtime":"aider","version_probe":["aider","--version"]}}
