{"schema_version":1,"slug":"opencode","definition_version":"1","executable":"opencode","adapter_id":"opencode-acp","interaction_modes":["pty","acp"],"model_requirement":{"required":false,"protocol_adapters":[]},"credential_bindings":[],"config_documents":[],"image":{"runtime":"opencode","version_probe":["opencode","--version"]}}
