{"schema_version":1,"slug":"loopal","definition_version":"1","executable":"loopal","adapter_id":"loopal-acp","interaction_modes":["pty","acp"],"model_requirement":{"required":false,"protocol_adapters":[]},"credential_bindings":[{"id":"anthropic","source":{"kind":"credential_bundle","ref":"loopal"},"target":{"kind":"env","name":"ANTHROPIC_API_KEY"}},{"id":"openai","source":{"kind":"credential_bundle","ref":"loopal"},"target":{"kind":"env","name":"OPENAI_API_KEY"}},{"id":"google","source":{"kind":"credential_bundle","ref":"loopal"},"target":{"kind":"env","name":"GOOGLE_API_KEY"}}],"config_documents":[],"image":{"runtime":"loopal","version_probe":["loopal","--version"]}}
