{"schema_version":1,"slug":"minimax-cli","definition_version":"1","executable":"mmx","adapter_id":"minimax-pty","interaction_modes":["pty"],"model_requirement":{"required":true,"protocol_adapters":["minimax"]},"credential_bindings":[{"id":"minimax-api-key","source":{"kind":"model_resource","ref":"minimax"},"target":{"kind":"env","name":"MINIMAX_API_KEY"}}],"config_documents":[],"image":{"runtime":"minimax-cli","version_probe":["mmx","--version"]}}
