{"schema_version":1,"slug":"claude-code","definition_version":"1","executable":"claude","adapter_id":"claude-stream-json","interaction_modes":["pty","acp"],"model_requirement":{"required":true,"protocol_adapters":["anthropic"]},"credential_bindings":[{"id":"anthropic-api-key","source":{"kind":"model_resource","ref":"anthropic"},"target":{"kind":"env","name":"ANTHROPIC_API_KEY"}},{"id":"anthropic-base-url","source":{"kind":"model_resource","ref":"anthropic"},"target":{"kind":"env","name":"ANTHROPIC_BASE_URL"}}],"config_documents":[],"image":{"runtime":"claude-code","version_probe":["claude","--version"]}}
