{"schema_version":1,"slug":"cursor-cli","definition_version":"1","executable":"agent","adapter_id":"cursor-acp","interaction_modes":["pty","acp"],"model_requirement":{"required":false,"protocol_adapters":[]},"credential_bindings":[{"id":"cursor","source":{"kind":"credential_bundle","ref":"cursor"},"target":{"kind":"env","name":"CURSOR_API_KEY"}}],"config_documents":[],"image":{"runtime":"cursor-cli","version_probe":["agent","--version"]}}
