{"schema_version":1,"slug":"openclaw","definition_version":"1","executable":"openclaw","adapter_id":"openclaw-pty","interaction_modes":["pty"],"model_requirement":{"required":true,"protocol_adapters":["openai-compatible"]},"credential_bindings":[{"id":"openai","source":{"kind":"model_resource","ref":"openai-compatible"},"target":{"kind":"env","name":"OPENAI_API_KEY"}}],"config_documents":[{"id":"openclaw-json","format":"json","target_path":"openclaw-home/.openclaw/openclaw.json","required":false}],"image":{"runtime":"openclaw","version_probe":["openclaw","--version"]}}
