{"schema_version":1,"slug":"pattern-designer","definition_version":"1","executable":"codex","adapter_id":"codex-app-server","interaction_modes":["pty","acp"],"model_requirement":{"required":true,"protocol_adapters":["openai-compatible"]},"credential_bindings":[{"id":"openai","source":{"kind":"model_resource","ref":"openai-compatible"},"target":{"kind":"env","name":"OPENAI_API_KEY"}},{"id":"lovart-access-key","source":{"kind":"credential_bundle","ref":"lovart"},"target":{"kind":"env","name":"LOVART_ACCESS_KEY"}},{"id":"lovart-secret-key","source":{"kind":"credential_bundle","ref":"lovart"},"target":{"kind":"env","name":"LOVART_SECRET_KEY"}}],"config_documents":[],"image":{"runtime":"codex-cli","version_probe":["codex","--version"]}}
