{"schema_version":1,"slug":"gemini-cli","definition_version":"2","executable":"gemini","adapter_id":"gemini-acp","interaction_modes":["pty","acp"],"model_requirement":{"required":true,"protocol_adapters":["gemini"]},"credential_bindings":[{"id":"gemini-api-key","source":{"kind":"model_resource","ref":"gemini"},"target":{"kind":"env","name":"GEMINI_API_KEY"}}],"config_documents":[],"image":{"runtime":"gemini-cli","version_probe":["gemini","--version"]}}
